seg_0000.wav|Добрый день. Театр «Кукул-Голивер», добрый день. Привет, скажите, пожалуйста, а могу ли я переговорить с отделом организации концертов и театральных программ?
seg_0001.wav|и до человека занимается с отделом закупа.
seg_0002.wav|Сейчас я соображу структурное подразделение, объединение театральной концерты. Туда надо звонить КТКО. Нет? Да, можно и туда, и свой телефон не подскажете КТКО.
seg_0003.wav|А я с ними не созваниваюсь, мы так не будем пешком. Вы только что предложили ваш номер из фармонии вашего города? Я администратор. Я просто администратор. А телефон скинулась. Как зовут директора Театра Кукол?
seg_0004.wav|Директор, она худруку на ставке директоров нету, потому что директор в объединении. Худрочный руководитель Белова Ирина Владимировна. 46, 168.
seg_0005.wav|Два. Как Людмила Владимировна? Ирина.
seg_0006.wav|Ирина, Ирина Боги и мировна
seg_0007.wav|46-62
seg_0008.wav|Благодарю вас. Скажите, а кот был? А кот пурган какой-нибудь?
seg_0009.wav|Трицать пять, двадцать два. Трицать пять, двадцать два, сорок шесть, шесть два, двести, шесть два. Все правильно?
seg_0010.wav|Пожалуйста, дождитесь ответа оператора или наберите добавочный номер сотрудника. По кончане набора нажмите решетку.
seg_0011.wav|Субтитры субтитры субтитры субтитры
seg_0013.wav|Позвать программу. Могу ли слушать стрим, Вадим Ивановна?
seg_0014.wav|А кто спрашивает о том, что не отсоединяется с обещаниями? А если вы заняты обгопления, беспокойтесь в Екатернбурге, компания Мультимедиа видит система.
seg_0015.wav|Ну а почему Сирена Владимировна? Потому что я так понял, что Сирена Владимировна возглавляет и обязанности директора, как я понимаю, совмещает с театр «Кукол». Я попробовал позвонить сначала по общему номеру, повеселился администратором, сказали, что это лучше разговаривает с Сиреной Владимировной.
seg_0016.wav|А после этого он никого не обратится. Юлия Владимировна из Феврормонии.
seg_0017.wav|У нас, я, не буду чему, я с Лириной Владимирович, я говорю, это вы.
seg_0018.wav|Нет, нет, нет, нет, нет, нет. Я помощник художественного руководителя Оксана Петровна. Я поэтому и уточняю, что вы хотите, вот вообще суть хочу понять. А, пожалуйста, Оксана, как участвуете? Петровна. Оксана Петровна, сейчас запишу. Оксана Петровна. Оксана Петровна, значит, вот какая ситуация. Мы с курганским театрально...
seg_0019.wav|Ну, в общем-то, с Вашим КТТО, мы сотрудничали с КТКО. А значит, для театров, не для театров, для филармонии Кургана, наша компания разработала с сайтами.
seg_0020.wav|И, громе того, внезрил этот сайт по штуческой картов. Неважно, как этот его вот.
seg_0021.wav|Наш генеральный директор завтра будет вместе с нашим главным инженером в ваших городе после рабочих делов.
seg_0022.wav|и попросил меня, кроме встречи филармонии, которые у нас удача ждут, попробовать организовать встречи с предприятиями, которые в КТТО входят.
seg_0023.wav|Вот ваш театр прекрасный кукол, насколько я понимаю, прекрасно входит с него.
seg_0024.wav|И возможно ли нам с кем-то встретиться из вашего театра? Ну, допустим, с Ириной Владимировной, да? Вот с ней навряд ли. Я думаю, что вам, наверное, тот, кто именно занимается, курирует у нас сайты и все прочее, Вадим Александрович. Все скорее, что с ним, наверное, она скажет.
seg_0025.wav|Ну давайте тогда, может быть, вы не дадите контакт, Вадим Александрович, чтобы я ему позвонил и договорился о встрече.
seg_0026.wav|Так, так, так, так, сейчас секунду, я поищу номер телефона.
seg_0027.wav|Да, да, да, Вадим Александрович.
seg_0028.wav|А кто вас вообще возгуляет?
seg_0029.wav|Антибина Виктора Николаевич, генеральный директор.
seg_0030.wav|У них тоже Алипатов занимаются с файтом. Я не знаю, конечно, художественным руководителем передам. Записывайте 8,961. Секунду 8,961.
seg_0031.wav|8-2, 8-2, 8-2. Скажите, пожалуйста, Ксана Петровна, я могу сказать, что этот номер его прямой вы мне предоставили? Конечно, конечно. Он понимает, он раз занимается сайтом нашим, значит, он ответит вам об этом. Я бы очень хотел, конечно, с Вадимом Александровичем переговорить, и чтобы встречи нам не отказали, а раз уж мы вас там будем. Конечно, конечно. Давайте вы ему все объясните, вы на доступном языке будете с ним разговаривать, он уже художественному руководителю подойдет и все еще раз тоже нам объяснит, хорошо? Так, хорошо, Ксана Петровна, скажите, пожалуйста, я позвоню в гулевер, а если у вас телефон контакта подобного, значит, от Антибина, который возглавляет КТТО, чтобы я попробую еще и с ним поговорить. Приемная генерального тенна… Так, Антибин.
seg_0032.wav|Николаевич, Николаевич, приемная!
seg_0033.wav|46-23-90, это секретарь Марина Константинова будет. Тефон запишет секретарь Марина Константинова. А вот вы сказали, что он именно есть и некий еще господин, который занимается как раз этой всей цифрой. Ну да, Липатов Липатов. Я думаю, что Иван Вспиреноправит на него Артем Александрович, он у него программист. Я думаю, что он тоже.
seg_0034.wav|Александрович. Благодарю вас, Александр Петрович. Сильно помогли. Я сейчас тогда звоню сначала Вадиму Александровичу, на номер 2, а потом перейду к Антибину, Виктору Николаевичу. И еще, значит, это у меня директор КТТО. Чудесно.
seg_0035.wav|Так, ну, а скажите, пожалуйста, имеет ли мне смысл у вас узнать телефон драм-театра Шадринской Кургана?
seg_0036.wav|Так, Шадринск, Курган, Курган, смотрю. Так, Курганский драмтеатр, пишите 46. Шурган, Курган.
seg_0037.wav|35-22-46
seg_0038.wav|21-23, Адринская, там тоже секретарь Любовь Николаевна, она вас направит, я у них точно не знаю этого айтишника. Вот сейчас у меня зашел как раз Вадим Александрович, вы можете меня поговорить.
seg_0039.wav|Вадим Рассадович, приветствуем вас. Мы разработали для вашего Каттула сайт и пытались подключить не пытались, а вынедрилит туда пушекскую карту.
seg_0040.wav|Завтра у нас генеральный директор, вместе с нашим главным инженером, будет в вашем чудесном городе. У нас встреча назначена с начальником делой организации концертов с Юлием Владимировной в Филармонии.
seg_0041.wav|И безусловно заскочить и к вам, Владимир Александрович, в какое время можно к вам подъехать, чтобы узнать о возможных перспективах партнерских отношений с вашим театром-хуком?
seg_0042.wav|Так, а у нас же нет, мы же часть КТКО, так что это... Ну, приговори, вы знаете, в ваших потребностях, я понимаю, что вы часть КТКО, я это прекрасно понимаю.
seg_0043.wav|На детского завтра время мы подстроимся по двадцать.
seg_0044.wav|чтобы с вами встретиться и побеседовать о возможных сотрудничествах на базе ваших театров, чтобы дальше мы пошли уже к антиберам. А мы без них не можем. У нас нет никаких полномочий самостоятельных.
seg_0045.wav|Ага, то есть на оконтибину. Ясно. Вернее, даже оконтибина, скорее всего, не. Ну что ж, благодаря вас, благодаря вас. Но в любом случае, если за... То есть если какие-то деловые и прочие такие штуки, это все там филармонии. Ну а у вас есть потребности? Скажите, пожалуйста, Владимир Александрович.
seg_0046.wav|Ну у нас вот сайт есть, он нам пока... А может быть звуковое аудио-видеооборудование, как будто мультимедийного характера, экраны, проекционные листы. Ааа, ну это уже другое дело. Вот, вот, мы по этому работаем, по этому направлению. Не только с сайтами занимаемся, у нас компания называется Multimedia, видите, система. Мы занимаемся партию, поставками оборудования, свет, звук, аудио-видео. Так, во сколько вы завтра будете? И где? Или когда? Вот, может, с двух до трех, скорее всего, будем встречаться в филармонии.
seg_0047.wav|Завтра будут люди, скорее всего, звукари и светлые имя. Я думаю, им будет интересно.
seg_0048.wav|Так, это мне надо смотреть, я так не скажу вам.
seg_0049.wav|Куда вам сообщить? Акстана Петровна мне дала вам что-то новое. Если я бы вам, допустим, перезвонил бы через какое-то время, сейчас брошу вам визитку, но что-то он умер. А вы мне на визитке бы в ответ написали, в какое время можно вам подъехать.
seg_0050.wav|Хорошо. Хорошо. У вас адрес у тебя. Расскажите, пожалуйста, о шуме. О, советская С-104.
seg_0051.wav|Это буквально там в 5 метрах от вармонии. Чудно. Вадим Александрович, я сейчас на этот номер. Разбрасываю телеву. В телеграм сбрасываю визитку. И жду от вас информации по поводу... Все я понял. Хорошо. Спасибо. Спасибо. Договорились.
seg_0052.wav|Скажите, Наталья Улерина, здравствуйте, Алексей беспокоит из-за Катеринбурга. Мы договорили с Юлей Павловной переговорить, я никак не могу дозвониться, может быть связи нет. Твялька хорошая такая, да.
seg_0053.wav|может быть вы пригласите
seg_0054.wav|к вашему телефону или пауну. Она вообще на месте в библиотеке? Она на месте, на нашей другой библиотеке.
seg_0055.wav|Ааа, она в другой? Да, ну вот, вот...
seg_0056.wav|У нас связь такая не очень хорошая, а я думаю, что пару раз попробуйте. Ну, с этого телефона-то у меня есть напрямую. Простите, посильнее, что я вам набрал. Ничего-ничего. Ладно, буду да илю-паунта дозвонить. Да-да-да. Спасибо. Да, пожалуйста.
seg_0057.wav|Юля Павловна? Юля Павловна, неужели я бы дозвонился до вас? Прочитался в общение, что такая связь? Фу ты, господи, ну я понимаю... Это ужасная связь, это не моя вина, это вот... Да, это такая вот связь. Юлечка Павловна, к вам вообще никаких контентей? Слава богу, что дозвонился. Юля Павловна, ну я, вы знаете, тема беседа такая. Я так понимаю, что мы с вами убрали полностью из коммерческого предложения дерева и у нас сейчас вам осталось 2 млн. 622 тысячи.
seg_0058.wav|Скажите пожалуйста, все ли вам подходит, все ли вас устраивает? Нет.
seg_0059.wav|У меня осталось из вашего расчета, а вот я сейчас его...
seg_0060.wav|Я попрошу вас обновить. Я подготовлю обновления с учетом всех ваших пожеланий. Да, да, да. Ну вот если мы начнем по порядку, значит сверху, вы уже открыли? Нет, я не могу уже найти.
seg_0061.wav|А, эээ... Очень много сообщений. А по-проходе найти нашу группу там, где вот...
seg_0062.wav|Наша группа МВС на Возовской ЦБС
seg_0063.wav|Вот я как раз это делаю и ищу.
seg_0065.wav|Вы понимаете, что я решения не одна принимаю? Это ж неполигиально.
seg_0066.wav|Смотрите, у нас осталось из актуального интерактивная писочница, интерактивный полгубопроекция.
seg_0067.wav|Мне актуально вообще, да, дерево тоже. Позвольте, позвольте я буду... ну дерево то вы сказали, я уже обочернул. Значит, давайте тогда я буду сейчас записывать.
seg_0068.wav|Я себе попишу так нового зона. Врата, у нас пришла дизайн, ну, пора, потому что мебель расчет, и у нас получается некуда эти столы интерактивны, и им правда не смешно.
seg_0069.wav|Их некуда ставить, а перегружать библиотеку интерактивом тоже не совсем, надо же, чтобы она работала. Интерактивный писочник.
seg_0070.wav|Интерактивный пол и ГОБА-проекция. Так, пол пишу. Интерактивный пол.
seg_0071.wav|Плюс... Гоба-проекция... Гоба-проекции... А вот количество 8 в этом расчете, что это значит? Это 8 будет у вас, Гоба-проекторов, которые буквально будут показывать стрелками, направление всех комнат, в том числе ваши рыбки... Нет, это у нас очень маленькое помещение и показывать нетчего.
seg_0072.wav|И так все понятно.
seg_0073.wav|она маленькая очень. Если брать, допустим, Дебальсова, там двухэтажное помещение, там, как бы понятно, можно заблудиться. А у нас негде блудить, просто негде. И эти вот проекты, как бы, производители, стрелочки эти, они как бы, они будут перегружать и так насыщенный вот этот дизайн, это все, ну как бы, господи, как это называется, потеряла плова.
seg_0074.wav|Указатели, указатели. Ну короче да, они просто потеряются в общем, в общем афе того, того мебели, которое нам планируют поставить. А на потолок, ну это... Я, конечно, ни в коем случае вам не советую, я вам хочу сказать, приехал, когда на Рыжный.
seg_0075.wav|Это директор вашей гиблиотеки Крымской, Вдебальцева. Да-да-да. Он такой посмотрел, говорит, господи, а вы где это взяли? А он говорит, вот у нас. Он говорит, позвите-те к ребятам. Ну, вот мы у него были. Вот я вам рекомендую, посмотрите, помещение Нарызного это огромнейшее помещение республикальной библиотеки. Я побыл. Да. Тяжаться с республикальной библиотекой ни в коем мере я даже даже не могу. Юля Павловна, я ж вам не скоро. Гоба Прекция вычеркиваем. Да. Мне надо вот, проекция, которая вот в коридортике будет рыбки. Да. Ну, это понимаете. Или не рыбки, а другие моменты. Ну, или осьминоги, или околы. Так вот, смотрите, чтобы вот эту проекцию сделать, нужно нам с вами туда проектора сделать. Это не Гоба Прекция, это сопроцентный проектор, который будет показывать вот именно над входом. Вы зашли вот, посетители, дети, дети там, взрослые бабушки. И вот этот проектор висит прямо над дверями и проецирует это изображение. Тогда это будет. Это называется, мы вам можем такое поставить.
seg_0076.wav|Это интерактива. Хотим. Сделайте, пожалуйста, в этом, ну, вот это, в предложении, пожалуйста, я всё это... Я возьму, вы понимаете, как это будет? Я соберу эти все вот расчёты, и пойду к руководителю, у меня есть руководитель, и в каждую позицию я буду объяснять и рассказывать.
seg_0077.wav|А почему надо это и для чего это надо? Тут всё же не просто там.
seg_0078.wav|У нас с вами остается интерактивная песочница.
seg_0079.wav|интерактивный пол, вы сказали, и сейчас мы поговорили интерактивная стена, которая будет показывать надходом красивые динамичные картинки.
seg_0080.wav|Ну это не стена, нам стена не нужна. Нам нужно мне надо, чтобы она на полу вертелась.
seg_0081.wav|на полу, со ввертелось, до конца ввертелось, это все равно проектор нужен, понимаете, что будет происходить, но я пишу себе еще вертелось на полу.
seg_0082.wav|Так, вертелась на полу.
seg_0083.wav|Ага, и когда у него...
seg_0084.wav|Я не понимаю, я настолько далека от техники, я вижу конечные результаты. Я не знаю, как это делается, поймите правильно, но я буду показывать, мне надо, чтобы я так включила, она заработала. А у нас же с вами детская библиотека помалая, бюджет у нас 8 миллионов получается, да все.
seg_0085.wav|Уже там меньше, уже четыре с половиной забрали, да. А, четыре с половиной забрали, то есть забрали это на ремонт у вас.
seg_0086.wav|У нас есть декор «Авкон». У нас есть литература, которую мы обязаны. У нас есть наружные вывески. У нас есть мебель и дизайн. У нас есть ещё кондиционеры, бытовая техника, которую мы уже хотели бы предыдущить. Бутылую технику, кондиционера. Ну хорошо. То есть у нас получается на мультимедийку осталось 3,5 миллиона. И с того, что вы заказали, тут да 2 миллиона есть, понимаете. Давайте мы с вами перекрутим. Вот я, когда убрал у вас
seg_0087.wav|Значит, из бюджета дерева, которую мы вам предлагали, у нас осталось 2,6 миллиона 22 тысяч.
seg_0088.wav|2 миллиона сил, а что, 22 тысячи? Это вот правда, говорю.
