seg_0448.wav|Здравствуйте! Вас приветствуют уральский государственный колледж имени Ивана Ивановича-Паузунова. Дирекция. Если вы знаете внутренний номер сотрудника, наберите его в тоновом режиме для улучшения качества.
seg_0450.wav|Здравствуйте, вас приветствует Уральский государственный колледж им. Ивана Ивановича Ползанова, дирекция. Если вы знаете внутренний номер сотрудника, наберите его в тоновом режиме. Для улучшения качества обслуживания все разговоры записываются. Для соединения с приемной директом.
seg_0451.wav|Здравствуйте! Вас приветствуют Уральский государственный колледж имени Ивана Ивановича Ползонова. Дирекция. Если вы знаете внутренний номер
seg_0452.wav|Музык, пищевые церкви.
seg_0453.wav|Запишите сообщение, затем нажмите решетку или нажмите звездочку для соединения с оператором.
seg_0454.wav|Алло. Юля Павловна, приветствую вас. Алексей Андреев. Здравствуйте. Здравствуйте. Здравствуйте. Удобно вам говорить, не только? Ой, очень занято. Говорите. Ну, хочу сказать, что... Да, спасибо. Значит, смотрите, мы рассмотрели с удовольствием ваши...
seg_0455.wav|Теремочек для белочки и луковурья.
seg_0456.wav|Ну, честно говоря, удивлен стоимостью этого лукаморья, конечно, копеется. Нет, такое лукаморье вам поставить на смысл.
seg_0457.wav|Я поняла. По домику Белочки должен честно сказать, что с тем предложением, которое...
seg_0458.wav|Вам предлагают среди продекции, я такого никогда в жизни не видел.
seg_0459.wav|Но по-прежнему, хочу настаивать на решение, которое мы вам предлагаем, это пол и песочница. Почему вы считаете, что это хуже будет?
seg_0460.wav|Нет, я не считаю, что это хуже будет. Просто я не могу разбивать контракт на несколько частей.
seg_0461.wav|А вы что волнуете хотите посмотреть? У вас просто чеков может быть больше, чем одного, это точно.
seg_0462.wav|А кто вам запретил Министерство? Я что, Максик, знаю. Но не суть, не будем, не буду страшно. Слушайте, я не хочу сам и на эту тему разговаривать. Ну, простите, ну, мне, конечно, простите, но, как бы, мы же уже вышли на подписание договора, еще вчера. Саума, да, я так понимаю.
seg_0463.wav|Нет, алма дорога, приятно, что дешевле. А, ясно. Ну что ж, дорога. Вот. Да-да-да-да.
seg_0464.wav|А что вы приобретаете? Можно уточнить?
seg_0465.wav|А я вам уже рассказала, что мы приобретаем, я уже вам расписала.
seg_0466.wav|Ну что ж, всего доброго. До свидания. Да, да, да. Очень приятно было с вами поработать. Извините, если что-то не так. Может, в будущем что-то сложится. Я не последний раз живем. Мы только начинаем знакомиться с нашей Родиной. Поэтому, я думаю...
seg_0467.wav|Алло! Елена Арктодровна, здравствуйте! Александр Диндрафовский, Пурга Песлакова, это давно.
seg_0468.wav|Я просто хочу узнать, как у нас с бугалкером получается ронёс есть? Никак, никак не получается, у нас проблемы большие зарплаты, два месяца задержка зарплаты, она только пришла и начинает делать нас зарплату, внукать в эту программу.
seg_0469.wav|Когда она будет укисом.
seg_0470.wav|Я так все чувствую, но самое главное зерплата, она че? Зачем еще работать здесь на зерплата не будет?
seg_0471.wav|Ну вот, да. Ладно, не падайте духом, а у нас-то с вами все, как мы договаривались, на договор-то мы выйдем. Ну пока изменений, пока изменений никаких нет, я не знаю, как там, что когда вообще это начнется, потому что у них совсем все.
seg_0472.wav|Всё плохо. Ладно, Александр, не беспокойтесь. Главное, чтобы она научилась, вы получили зарплату.
seg_0473.wav|Скоро уже весна, слава тебе господи, и позвоню вам в конце будущей недели, договорились?
seg_0474.wav|Остный праздников. Вот он получается, позвоним числа 27-го.
seg_0475.wav|Я национально не слышу. Ну, договорились, думаю.
seg_0476.wav|Да, да, да. Ага, ну всё, давайте до связи. Доброго поводника. До свидания.
seg_0477.wav|– Алло. – Татьяна Николаевна, добрый день, Алексей Андреевич. – Да, добрый. – Я понял. Здравствуйте. – Простите, что мы с вами договорили, что после правильных звездок. Ну как у нас? – Нет, я с вами не договаривалась. То, что вы меня сбросили, послушайте меня, значит, вы мне прислали, еще прислали мне шесть таких предложений на запрос.
seg_0478.wav|Кто будет? Я не знаю. Цена очень крупная. Вы увидели. Вы там над вещами прислали, и у меня больше 2 миллиона.
seg_0479.wav|Согласно постановлению, я обязательно согласовываю крупные закупки с администрацией.
seg_0480.wav|Вот, и администрация сказала, раз идет такая крупная закупка, в нации сидел закупок и они будут заниматься этим вопросом, мы предоставим все документы и они будут их размещать.
seg_0481.wav|До сто тысяч и двести. Я их размещаю и работаю свыше.
seg_0482.wav|6 контрактов будут, которые свыше 2 миллиона, то есть администрация будет это всё контравировать.
seg_0483.wav|Да где они, Клэн? Да это прекрасно. Ничего страшного. Главное, сводить суть ранкого закона. Я говорю, кто вы? Кого выберут и выберут? Я не знаю.
seg_0484.wav|Мы предоставили все, что вы нам прислали. Пришла в Москву, прислала в Варуне.
seg_0485.wav|Ногочеркар, по-моему, еще кто-то. Никольно, адур оборудования будете произведить не вы, а кто-то в отделе культуры в администрации.
seg_0486.wav|Там комиссия, конечно, будет оседать и будет смотреть по ценовым пропозициям, по тем, что они помогают мне контракты разрабатывать и все такое прочее. Хорошо, я там поскорьку-посторку, знаете, сюда.
seg_0487.wav|не буду кого не выберут, не могу вам сказать. Я не клану, ну все в порядке, что хотел услышал, будем надеяться, что уберут нас.
seg_0488.wav|Мы все-таки добропорядочная интегратор и мультимедийная обрубка. Наверное, документы все, что предоставили, будут смотреть. Мы там, конечно, тоже будем присутствовать. Что нам там скажут и как это будет.
seg_0489.wav|Я не знаю. Без понятия. Я только написала на согласование большие...
seg_0490.wav|А что там будет когда-то? Как они будут? Я не могу вам сказать.
seg_0491.wav|или электронным способом, то ли там, то ли так, не могу. Какие у них будут квалификации?
seg_0492.wav|Вообще, это странно, хотя странно, потому что выбирать будет не его, это странно, поскольку по закону именно вы имеете право выбирать под чем тут администрация. Ну хорошо, у вас так так, ясно.
seg_0493.wav|Когда мне вам можно набрать? Скажите, пожалуйста, я не к вам уважаемый.
seg_0494.wav|Я не знаю, я только письмо в пятницу отправила. Когда будут они сказать, не могу вам сказать. Я описала условия закутки, какая сумма идёт на эти самые, что там они будут заседать, когда не могу вам сказать. Я ж вам говорю, потому что вы мне прислали, пришла вам мне Москва, прислала…
seg_0495.wav|И еще кто-то. И сегодня в коллеге сказали, что еще кто-то там прописывали. То есть не могу там. И может, всем, может, восемь претендентов. Я не могу вам сказать.
seg_0496.wav|Мы, конечно, будем присутствовать, но что там я не могу вам сказать пока. Кого они выберут, я не знаю. Не переживайте, все хорошо. Будем надеяться, что победим он этим. Да, будем надеяться. Спасибо.
seg_0497.wav|Добрый день. Скажите, пожалуйста, могу ли услышать Елена Санну? Это я? Елена Санна из Декотеринбурга Алексея беспокоит. Я просто уж переживаю из вас, начнёт ваших зарплаты. Получилось ли у вас всё?
seg_0498.wav|Нам деньги пришли по соглашению, но нам пришел на рубль больше.
seg_0499.wav|Поэтому нам сегодня опять отразвали соглашение.
seg_0500.wav|Сахтерскую один рубль не додали, а нам она один больше, поэтому нас опять забрали. Елена Русана, и сколько вы уже без зарплаты сидите?
seg_0501.wav|Вот мы последний раз получили 22 декабря.
seg_0502.wav|И как и живете на сону? Ну как и живем, так и живем.
seg_0503.wav|Тридитной карты. Вот, мне так жаль, Елена сам... Ладно, но у нас специалисты богаты. Разобраться, как с яйцом пользоваться.
seg_0504.wav|Сейчас в процессе она пришла, сейчас разбирается.
seg_0505.wav|То есть, есть вероятность, что мы с вами на этой неделе можем заключить договор.
seg_0506.wav|И я вам обещать ничего не могу, потому что у нас тоже она отвлекает иначе на нечетление зарплаты в новой программе и поэтому...
seg_0507.wav|Хорошо, Еленсан, я очень рад, что хоть какое-то движение в сторону зарплаты у вас пошло, надеюсь, что сейчас они там пересчитают и вам тика в тику деньги перешлют. Я вам наберу в пятницу, 27 числа. Да, хорошо.
seg_0508.wav|Давайте все хорошо! До свидания!
seg_0509.wav|Продолжение следует...
seg_0510.wav|А ты не видишь еще?
seg_0514.wav|БУЛЬНЫЙ ЗВОНОК БУЛЬНЫЙ ЗВОНОК
seg_0516.wav|Ну вот мы с вами организов Math
seg_0517.wav|Я слушаю вас. Илья Анатольевна, приветствую. Меня зовут Алексей Андреев. Звонок из Дикой Тиримбурга, компания Multimedia в виде системы.
seg_0518.wav|В середине месяца, по-моему, у вас связывался наш менеджер, Диана Теблдиева, по поводу потребностей в вашем оборудовании. Скажите, пожалуйста, по-прежнему актуально запрос, который я сейчас вижу и читаю.
seg_0519.wav|Я вам сейчас уже на данный момент. Я вам вообще он актуален.
seg_0520.wav|Но я вот прямо на данный момент, я вам не скажу точно, потому что, по-моему, в бухгалтерии уже на мультимедиа...
seg_0521.wav|На вот эту панель, уже по-моему они подали заявку, уже по-моему они там в процессе, если вы за, вы Москва?
seg_0522.wav|Нет, мы Екатеринборг, мы близок. Время Московское, да, у вас? Нет, у нас уральское время. У нас сейчас 17 часов 20 минут.
seg_0523.wav|Я просто уже с работы ушла, у нас сейчас 19.
seg_0524.wav|О, тогда прошу прощения, Ирина Анатольевна, может, я вам за номер позвонить? Нет, нет, за номер позвонить. Вот, да. И я вам дам номер телефона, девочки, девочек из бухгалтерия. И вот они вас точно скорректируют.
seg_0525.wav|По поводу на каком этапе мультимедийная панель.
seg_0526.wav|То есть, на каком этапе, где они?
seg_0527.wav|Ну, короче, мы поняли, да, о чём я? Да, конечно, понимаю, ориентированно. Да, поэтому без проблем напомните тебе завтра, я вам дам номер телефона девчона.
seg_0528.wav|Ирина Анатольевна, благодарю вас за то, что вы сошли, подняли телефон в нерабочий время. Завтра я вам позвоню и мы с вами обвиняемся с телефоном Боготерием. Да, все хорошо. Только в начале вашего дня, пожалуйста, хорошо? Да, я в девяточной работе, у нас девять. Отлично. Да, я позвоню тут.
seg_0529.wav|У вас в Москве какая разница? Два часа, вот у нас... А, два часа все В Москве это три, двадцать сейчас
seg_0530.wav|Всё, всё, поняла, поняла. Ладно, всё, спасибо большое. Ага, до завтра, спасибо.
seg_0531.wav|Алло, здравствуйте, а скажите, пожалуйста, могу ли служить зеленой теме Союона?
seg_0532.wav|Я вас слушаю. Здравствуйте. Я из Екатеринбурга, за ног. Меня зовут Андрей Алексей Лептиныч. Я представляю компания Multimedia и видит системы. С вами раннего связывался наш менеджер.
seg_0533.wav|по поводу оборудования для вашей библиотеки. Скажите, пожалуйста, вы по модельным библиотекам, по федеральной программе, выиграли? Да-да-да. Ага, вот. И я вот смотрю, а на короткий пересказ вашей беседы.
seg_0534.wav|А публиковала, что вам не авторактивный пол, большой телевизор и полный список, как они тут не писали, вы должны прислать нам на почту. Скажите, пожалуйста, Зеленая Тебя Суевна, расшевелся список, который у нас коллега предоставил или вы уже... Честно говоря, не, не, не, сейчас честно, вот...
seg_0535.wav|с температурой и не могу понять спит.
seg_0536.wav|А Зеленатя Мишоевна, я тогда от седуши желаю вам здоровья, выздоровления. Нет, нет, ну я просто хочу продолжить наш, просто я не могу сообразить, когда я отправляла, что сейчас вот этот... А возможно, это так, что входит. А на путь-то ничего-то пришло от вас.
seg_0537.wav|Ну, зеленать имисуально, может быть не позвонить попозже, когда вам удобнее будет, ну вдруг у день имеется, верно? Эээ, это может быть на...
seg_0538.wav|Я, пожалуйста, я презентацию нашей компании на почту пришлю.
seg_0539.wav|Библиотека 283 Генберта. Я вышел вам о своей презентации. В вашей презентации я выберу список, который нам подходит. Да с большим удовольствием. Но в этой презентации не все отображено, что мы можем. Но это просто презентационный лист.
seg_0540.wav|я по подробнее подправляю
seg_0541.wav|прямо сейчас сделаю вот и вы пожалуйста поправляйтесь вам завтра в какое время можно позвонить
seg_0542.wav|Ну, в первой половине, наверное. А дело то, он сейчас на рабочий телефон позвонил? Да-да-да. Господи, да слушай, температура на рабочий, что делаете?
seg_0543.wav|Хорошо, я вам сейчас направлю, но завтра в первые полдня вам позвоню.
seg_0544.wav|Да, все уже неком.
seg_0545.wav|Субтитры субтитры субтитры субтитры
seg_0546.wav|Добрый день. Скажите, пожалуйста, могу ли я на Сергею?
seg_0547.wav|А на отпуске? А на отпуске. Скажите, а кто бы мог ее заменить по вопросам закова с закупом мультимедийного оборудования?
seg_0548.wav|Слышишь? Слышишь? Слышишь? Слышишь?
seg_0552.wav|Добрый день. Из Никотельбурга обеспокоят компания Multimedia в виде системы. Система недавно, но может быть там неделя-две назад, наш представитель говорил с Уляно Сергеевной по поводу возможного приобретения вашего музейного выставочного центра мультимедийного оборудования. И вот из того, что я понял, что в Феврале можно связаться с вами по вопросу ваших потребностей.
seg_0553.wav|Да, но нам только, я так поняла, вы можете нам предоставить только панель, да, интерактивно. Я даже не знаю потребности ваших, мы, в принципе, можем предоставить все, что вы пожелаете, потому что мы являемся культурным атригатором на территорических стерациях.
seg_0554.wav|и работаем с музеями, с библиотеками, с театрами, с детским шоковым искусством и в принципе любое оборудование, которое необходимо, любое оборудование, которое свет, звук, проекционное, мы можем вам предоставить.
seg_0555.wav|Ещё хотел бы спросить, вы работаете по 44-му, да? Мы работаем по 44-му, по 223-му, в том числе. Вы и до, да, вы можете всё подпишут. До у нас есть и до, скб-кон. А скажите, а доставка платная у вас? Доставка ходит в 6-е масть оборудования.
seg_0556.wav|То есть это будет бесплатно. Скажите, если вы оборудование нам поставляете, вы потом его устанавливаете, или просто вставка? А установка оборудования тоже входит в стоимость оборудования. Мы прямо пропишем, что установка доставка входит в стоимость оборудования.
seg_0557.wav|Мы еще просто даже не знаем, что у нас как будет с нашей техникой.
seg_0558.wav|может быть даже это все закупки не закупки а может торги это все выйдет мы не знаем но на сколько понимаешь на данный момент еще соглашения нету с оглашением с муниципалитетом имеет в виду у вас нету да а вот скажите даже с министерством еще нету соглашения не с министерством не соглашение а с сердцем там есть вот перское область это понимаю да да а без деда вам какой-то выделили скажите пожалуйста
seg_0559.wav|Вообще, ещё нам ничего не выделили. И ничего вам не выделили. А что желаете?
seg_0560.wav|Вообще, у нас по смете идёт вот эта ноутбука, графические поншеты, интерактивная панель, МПУ, это интерактивная панель, хотели бы с Windows… Ясно, а диагональ какую? 65, наверное… 55, но не с Windows, а с операционной системой сейчас правильно говорить… Да, и на Android… И на подставке была… И на подставке, конечно…
