seg_0361.wav|Договорились. Что люблю свою, я вам найду. Жду вас. Спасибо. До связи. Какой до связи? Я летом опять на Рабудового участка, так что заеду с вами. Познакомиться лично. Хорошо. Познакомиться обязательно. Все, тогда ждите. Да, привет из общества. Спасибо.
seg_0362.wav|Добрый день! Скажите, кто с Томаголией, с Владимира Сергеевичем?
seg_0363.wav|Могу ли услышать время рассеклея часа фонового?
seg_0364.wav|Дон Басофера, да, только вы не в тот кабинет. Мне сказали 304-05-71. Без понятия. Я не знаю, вы туда попали. Это режиссерское. А вы не подскажете, что случилось с телефона Сафонова? Я не знаю.
seg_0365.wav|Девушка, я вас не только что беседовал по поводу телефона Сафонова В. Сергеевича, я попал в Режучерскую по номеру 304-0571.
seg_0366.wav|3,4,3,0,4 да, 304,0,5,71
seg_0367.wav|Добрый день. Скажите, пожалуйста, а могу ли вы услышать Владимир Сергеевичцев Паново?
seg_0368.wav|Может, вы подскажете, по какому номеру я могу его найти в вашем театре?
seg_0369.wav|Повторите еще раз, как? Может быть вы подскажете по какому номеру могу найти его в вашем театре? А фанилия имя учит? Сафонов Владимир Сергеевич Он в Тельника делаем того
seg_0370.wav|Да, я поняла. Нет, я вам не подскажу номер телефона.
seg_0371.wav|Здравствуйте! Вас приветствует Уральский государственный колледж имени Ивана Ивановича Ползонова. Дирекция. Если вы знаете внутренний номер сотрудника, наберите его в тоновом режиме. Для улучшения качества обслуживания все разговоры записывают.
seg_0372.wav|Для соединения с приемной директора нажмите 1.
seg_0373.wav|Здравствуйте! Вас приветствует Уральский государственный колледж имени Ивана Ивановича-Ползунова, дирекция. Если вы знаете внутренний номер сотрудника, наберите его в тоновом режиме. Для улучшения качества обслуживания все разговоры записываются. Для соединения с приемной директора нажмите 1.
seg_0374.wav|а сейчас я взау scene она совет но мухом а да
seg_0375.wav|Запишите сообщение, затем нажмите решетку или нажмите звездочку для соединения с оператором.
seg_0376.wav|Здравствуйте. Вас приветствуют Уральский государственный колледж имени Ивана Ивановича Ползонова. Дирекция.
seg_0377.wav|Если вы знаете внутренний номер сотрудника, наберите его в тоновом режиме.
seg_0378.wav|для улучшения качества обслуживания мистераattle-номерAwk. Для соединения с приемной директора нажмите 1. Для соединения с заместителем Директора по учебно-проезв aluminарпорту от Nine jobs, нажмите 2. Для соединения с заместителем директора по учебно-воспил tightening stop three jest в expects и страдания sectям документemen 보여 Motorsports-обробโmouth Group
seg_0379.wav|Ну, вообще-то формально, конечно, они как правило, но, как правило, как ищут.
seg_0380.wav|Здравствуйте! Вас приветствует Уральский государственный колледж имени Ивана Ивановича Ползонова. Дирекция.
seg_0381.wav|Если вы знаете внутренний номер сотрудника, наберите его в тоновом режиме. Для улучшения качества обслуживания все разговоры записывают.
seg_0382.wav|Для соединения с приемной директора нажмите 1. Для соединения с заместителем директора по учебно-производственной работе нажмите 2. Для соединения с заместителем директора по учебно-воспитательной работе нажмите 3. Для соединения с заместителем директора по закупкам и маркетингу нажмите…
seg_0383.wav|СПОКОЙНАЯ МУЗЫКА
seg_0384.wav|Здравствуйте! Вас приветствуют Уральский государственный колледж имени Ивана Ивановича Ползунова. Дирекция. Если вы знаете внутренний номер сотрудника, наберите его.
seg_0386.wav|Добрый день. Скажите, пожалуйста, могу ли слышать любовь или они давно?
seg_0387.wav|Здравствуйте, меня зовут Алексей Андреев и я посылаю компания Multimedia в виде системы.
seg_0388.wav|Вот по какому вопросу звонёс, с вами ранен связывался мой коллега.
seg_0389.wav|и выяснил, что у вас есть потребности в программном ученее.
seg_0390.wav|Ну да, вчера разговаривали, да. Да, вчера разговаривали. Я, правда, не знаю с кем из моих коллег.
seg_0391.wav|Вот, я хочу вам сообщить, что у нас есть целая доля разработки, которая занимается программом воспитания.
seg_0392.wav|Можно поподробнее узнать, какой у нас бюджет и какого прогрода, прогрена обеспечения вам необходимо.
seg_0393.wav|и на основе чего вы уже, вот если у тебя классы работали, на основе какого программа на ощущениях.
seg_0394.wav|Давайте все объясню вам. Дело в том, что пока что еще VR-класс не работали, мы только собираемся внедрять VR-класс. У нас есть 8 комплектов очков с компьютерами, с ноутбоками, и в принципе есть буквально один курс, то есть это обычный цок, то есть это обычная цифровая лаборатория по строительным работам, но она с переводом на VR.
seg_0395.wav|Все остальные комплексы, которые мы закупали, то есть они без, скажем так, возможности показывать им что-то с верочками.
seg_0396.wav|оборудование есть, а по программному обеспечению немножечко тут мы вышли за труднение у нас.
seg_0397.wav|Мы в принципе, может быть, и сами разрабатывали, если был бы конструктор какой-то, я, в принципе, это и спрашивала, если какой-то конструктор для разработки, потому что, ну, программист есть, плюс у нас тут планируется проект с школьниками, которые занимаются этим направлением. Просто нам нужно что-то установить на компьютеры, чтобы можно было этот проект привязывать.
seg_0398.wav|Так у нас строительное направление, что бы хотелось видеть, какие направления, но, во-первых, это что-то построительство, чтобы можно было. Но, опять с другой стороны, большие мастерские, где дети могут это всё живём, посмотреть и сделать, выполнить ручками своими. Поэтому какие-то такие темы, которые мы не можем выполнить, скажем так, мастерские, чтобы ребята просто могли так визуально посмотреть это всё в 3D. Плюс для скорников, это, конечно, профритационный комплекс, чтобы они могли... Ну, посередная работа достаточно, тут надо писать довольно увесистый ПООП. Я предлагаю вам, уже, а мы, любовь, Леонидовна, давайте -ка мы с вами встретимся, я привезу к вам нашего четыркулдителя отдела разработок.
seg_0399.wav|который более реальным представляет я из-за дела продаж возгуляю в виду проекта
seg_0400.wav|и допустим, вы бы были, я бы привез нашего специалиста и кто-то значит и...
seg_0401.wav|коллег практиков по VR-ПО, который вам нужно. Стрительная колледж, что у вас, какого рода направление в стрительстве? Редактор субтитров И.Бойкова Корректор А.Егорова
seg_0402.wav|Что вы строите? Скажите пожалуйста, какие-то металлоконструкции, какие-то... Нет, строительство, обычная стройка.
seg_0403.wav|для дома строить. Дома, да, конечно. Дома, плюс... Емущиться как ласкерпич, как заливать бетонами, правильно понимаю? Ну, да, но у нас великолепные мастерские, где, в принципе, это можно что-то попробовать, конечно, вот так вот, ну, приточная кладка идет, то они могут это попробовать в своих мастерских либо волярные работы какие-то. А вот что-то, что вы сказали, как раз, по бетону может быть еще по каким-то там, по арматурным работам, еще что-то. Вот это, конечно, уже проблематично, где-то тут у вас нужно выходить на производственную практику, и практика производственная есть, и дети посмотрят, но чтобы это хотя бы знали, они где-то, вот, может быть, и до практики. Да, конечно, сейчас очень полно разных всяких уроков, которые можно посмотреть, и педагоги используют их, но просто комплект, комплекты наши, авиаровские, закупленные должны работать.
seg_0404.wav|и что-то к ним должно быть.
seg_0405.wav|То, что у нас есть по малярным работам, комплексам, ребятам, которые учатся по малярным работам, обучаются по малярным декоративным работам, мастера. Но они это все мастерски сделают. Интересно, этот комплекс оказался школьником.
seg_0406.wav|Либо совсем первокурсникам, которые только-только еще впервые пришли, не знаю, как смесывать краски, какие инструменты бывают. Для них это да, для водной лекции интересно, но что-то такое более, скажем так, глобально, а для школьников интересно, потому что школьники это вообще никогда не увидят и мастерских нам вряд ли это как бы посмотрим. А на какие специальности вы учите в вашем учреждении? Так, на рабочий плиточник, молят сварщик, авто механик, мастер же кхану, это как сантехник.
seg_0407.wav|Это профессия, а по специальностям архитектура.
seg_0408.wav|визайн, строительство эксплуатации, осознание сооружений, землюстройство, по землюстройству было бы очень великолепно, просто по кодастам. Землюстройство это прикольно, это кодаст, которые вы оправдываете. Да-да-да-да, это у нас новое направление со всем. Ветеринария, плюс на техническое обслуживание ремонта автомобильного транспорта и еще управление на квартирном доме тоже интересно. Обалдеть, безусловно интересно. Кстати, ну я согласен с вами, Любовь Жильна.
seg_0409.wav|Так, какой наш бюджет, скажите, вы планируете потратить на вот данное, значит, программное обеспечение? Ну, вы знаете, вот честное слово в данном вопросе, но здесь, наверное, совсем все туго, потому что мы бюджетники. И я, в принципе, когда позвонила кто-то, я не помню, женщина, по-моему, не от вас, да, я-то сказала, что просто интересно, знаете, сколько примерно это все будет стоить, потому что, но бюджета, в принципе, очень мало, очень мало. И если бы был просто какой-то конструктор, чтобы можно было нам саме что-то создать, потому что я знаю, что заказывать индивидуальное программное обеспечение – это очень дорого. Мы, наверное, на такое неподвижение. Вот, что ведь, ну, тем не менее, давайте я все-таки предлагаю вам на первом варианте остановиться.
seg_0410.wav|Ну, допустим, после праздников, у нас 24 февраля, я уже там еду на другую встречу. Если числа 25-го, вы к вам приехали, вместо Саши греховым, на встречу к вам. И мы вас с вами подробно бы, по-высимым, побеседовали.
seg_0411.wav|Во-первых, про платформу, про моделирование конструктора, где вы сами могли что-то придумать, да, и сделать.
seg_0412.wav|вот этому нашему специалисту, греху Александру, нужно просто понять, и он скажет, да, у меня это есть.
seg_0413.wav|Да, это первый вариант. Второй вариант он внимательно послушен. Я могу сделать вам то, что вы хотите, допустим, для...
seg_0414.wav|Ну, для землемерного дела вашего, да, я могу приложить какую-то программу, так-то сделать.
seg_0415.wav|и это будет стоить сокота. Я думаю, что вам будет интересно посричаться и выскаживать предложение нашего руководителя отдела разработки.
seg_0416.wav|На 25 число это у нас среда по-моему будет, сейчас я посмотрю, 25, да это среда
seg_0417.wav|Будет время? Нет, 25-го у меня приезжает губернаторский лицейм на день карьеры, поэтому весь день занято у нас. Да ладно, давайте 26 и 27 числа.
seg_0418.wav|У нас вообще в сроке есть какие-то по… Да, есть у нас в сроке, я просто к тому, что этот класс у нас, мы только внедряем еще новый проект для нас со всем, и поэтому…
seg_0419.wav|Есть руки-то, конечно. Я бы, может быть, вас даже пригласила, когда мы уже что-то установим на программ обеспечения, значит, когда мы уже установим технику, просто он пока ещё в ремонте помещение. А, в припомещении в ремонте.
seg_0420.wav|Ну, в таком случае, в любом случае, давайте действительно будем логичными, когда ремонт помещения кончится, когда, значит, оборудование расстается, вот тогда может, имеет смысл у нас с вами подключаться.
seg_0421.wav|Ну конечно, конечно, тогда. Примерно какой месяц всегда, скажите.
seg_0422.wav|Ну я думаю, в марте-то, к концу марта уже, наверное, что-то... Там, в принципе, уже сейчас можно просто еще один объект и монтируется, поэтому пока нет.
seg_0423.wav|не зря вот я знаю что такое конститутор такое обеспечение есть даже школьники разрабатывают такие уроки
seg_0424.wav|И у нас-то, видите какая ситуация тут, я хочу со школьниками замутить проект профориентационный, как раз по разработке от нас, оборудование, от них программное обеспечение, но они там сделали по тем заданию, то есть это будет, конечно, крутой проект, они сделали, все представили, но дай, что нам с вами работать, еще надо тоже внедрять это все дело.
seg_0425.wav|Поэтому как-то... К сожалению, настолько далеко от всего того, что вы сейчас говорите, программирование, вот это всего профорентация, мне больше понятно.
seg_0426.wav|Поэтому я предлагаю настойчиво постречаться. Можем завтра, если вы говорите, что не можем завтра. А, не можем завтра. 25-30, не можем. На конец смарта будем договориться.
seg_0427.wav|Ну да, наверное, ну или хотя-бы где-то в середине контрольный звоночек и потом дальше посмотрим. Легко. Любовь Лидина, запишите пожалуйста мы прямо номер телефона.
seg_0428.wav|Готовы? Да-да-да. Плюс 7.
seg_0429.wav|Восемьсот шестьдесят пять. Минут Андреев, Алексей Лифтинович.
seg_0430.wav|Андреев Алексей, можно просто записать. Андреев Алексей Алексеевич. А Лев Тинович.
seg_0431.wav|Редко, несложно, но редко... Редко, да.
seg_0432.wav|Любовь Линдон, вам не скажите, пожалуйста, свой номер контактный. Я вам сейчас на ваш номер, если там есть телеграмм правил бы свою визитку.
seg_0433.wav|и попросил бы вас тогда мне напомнить о наших встречах с вами в середине марта.
seg_0434.wav|912, 651, 47, 85. 85. Я сейчас себе туда в календарь поставлю, чтобы середина Марта вам сделать звонок. Сейчас на этот номер я отправлю свою визитку. Там есть сайт нашей компании, вы можете зайти и ознакомиться.
seg_0435.wav|с нашими работами уже выполнены проектами. Там, к сожалению, не очень много про отдел разработки, но просто хоть посмотрите, чем мы занимаемся, чем мы еще можем быть полезны вашим учебным образаклем заведения.
seg_0436.wav|А, у нас, давайте тогда так, я сейчас начнем с того, что обменялись телефонами, я вам визиточку отправлю, поставлю себе в календарь.
seg_0437.wav|и тогда начнем сотрудничество с дальнейшим общением.
seg_0438.wav|Договорились? Хорошо, хорошо. А секундочку еще, Любовь Людмила, а как правильно у вас колес с техником? Как вы? Колес? Колес у вас. А вот у КПТ, ГАПУ, это вот, это где вот?
seg_0439.wav|УКПТ? УКППРИЗ? Технологии предпринимательства.
seg_0440.wav|Дальше ничего нет? Нет, дальше есть ГАПОУ. Это в начале, это не дальше, это ГАПОУ СО.
seg_0441.wav|государственной, остановной, профессиональной образовательной очередине Северловской области.
seg_0442.wav|Всё, понял. Совсем далеки вы от образования, правда? Такое культурное, по культуре до пора разработка. Ну что ж, давайте да так, любую фильму, хотя нет, я вам скажу, что не с ним. В общем, при встрече вам расскажу много интересных культурей, которые связаны с образованием от нашей компании.
seg_0443.wav|и больше ленина все давайте тогда значит спасибо за ваше время я вам сейчас отправлю свою визиточку вы идите на наш сайт
seg_0444.wav|Мой номер его записали, и там на визитке он тоже будет записать.
seg_0445.wav|И в середине марта я выхожу с вами на спец. Хочу сказать, что хочу поздравить вас наступающим праздникам весны с 8 марта.
seg_0446.wav|Прям с языка сняли, а я хотела поздравить вас наступающим прайпиком. Нет, у вас на языке вот это, думаю, пережутка, любовника Леонидовна.
seg_0447.wav|Хорошо, хорошо. Спасибо, вас тоже. Поднимаю, поднимаю. Всего доброго. До свидания.
